attribute_name,description,data_domain,nullable,is_primary_key,status,source_columns,comment
Taxpayer Representative Id,Id tự sinh (surrogate key),Surrogate Key,false,true,draft,,"PK surrogate. BCV: ""Involved Party"" — người đại diện của NNT."
Taxpayer Representative Code,ID bản ghi người đại diện. BK,Text,false,false,draft,DCST.TTKDT_NGUOI_DAI_DIEN.ID,BK chính. PK nguồn.
Source System Code,Mã nguồn dữ liệu. Giá trị: DCST.TTKDT_NGUOI_DAI_DIEN,Classification Value,false,false,draft,,Scheme: SOURCE_SYSTEM. BK. Hardcode.
Registered Taxpayer Id,FK đến Registered Taxpayer,Surrogate Key,false,false,draft,DCST.TTKDT_NGUOI_DAI_DIEN.THONG_TIN_DK_THUE_ID,FK target: Registered Taxpayer.Registered Taxpayer Id. Pattern Id + Code.
Registered Taxpayer Code,Mã NNT,Text,false,false,draft,DCST.TTKDT_NGUOI_DAI_DIEN.THONG_TIN_DK_THUE_ID,FK target: Registered Taxpayer.Registered Taxpayer Code. Pair with Registered Taxpayer Id.
Representative Name,Tên người đại diện/chủ hộ KD,Text,true,false,draft,DCST.TTKDT_NGUOI_DAI_DIEN.TEN_NNT,"BCV: ""Individual Name"". Dùng prefix ""Representative"" để phân biệt với NNT."
Position Title,Chức vụ người đại diện/chủ hộ KD,Text,true,false,draft,DCST.TTKDT_NGUOI_DAI_DIEN.CHUC_VU,"BCV: ""Employment Position Title""."
