attribute_name,description,data_domain,nullable,is_primary_key,status,source_columns,comment,classification_context,etl_derived_value
License Application Processing Activity Log Id,Id tự sinh (surrogate key),Surrogate Key,false,true,draft,,"PK surrogate. BCV: ""Business Activity"" — nhật ký hoạt động hệ thống.",,
License Application Processing Activity Log Code,Mã định danh (tự động tăng). BK,Text,false,false,draft,NHNCK.ActionLogs.Id,BK chính.,,
Source System Code,Mã nguồn dữ liệu,Classification Value,false,false,draft,,Scheme: SOURCE_SYSTEM. BK. Hardcode.,SOURCE_SYSTEM=NHNCK.ActionLogs,
Officer Id,FK đến tài khoản thực hiện,Surrogate Key,true,false,draft,NHNCK.ActionLogs.UserId,FK target: Regulatory Authority Officer.Officer Id. UserId = tài khoản thao tác.,,
Officer Code,Mã tài khoản thực hiện,Text,true,false,draft,NHNCK.ActionLogs.UserId,FK target: Regulatory Authority Officer.Officer Code. Pair with Officer Id.,,
Client Machine Address,Địa chỉ IP máy thực hiện,Text,true,false,draft,NHNCK.ActionLogs.ClientMachine,,,
Activity Detail,Mô tả nội dung thao tác,Text,true,false,draft,NHNCK.ActionLogs.Detail,,,
Created Timestamp,Ngày tạo,Timestamp,true,false,draft,NHNCK.ActionLogs.CreatedAt,,,
