attribute_name,description,data_domain,nullable,is_primary_key,status,source_columns,comment,classification_context,etl_derived_value
Account Investor Group Id,Khóa đại diện cho nhóm tài khoản nhà đầu tư.,Surrogate Key,false,true,draft,,,,
Account Investor Group Code,Mã nhóm (hệ thống tự sinh). BK.,Text,false,false,draft,GSGD.account_group.group_code,BK chính.,,
Source System Code,Mã nguồn dữ liệu.,Classification Value,false,false,draft,,,SOURCE_SYSTEM=GSGD.account_group,
Group Name,Tên nhóm.,Text,true,false,draft,GSGD.account_group.group_name,,,
Group Type Code,"Loại nhóm: 1=Thường, 2=Nghi vấn.",Classification Value,true,false,draft,GSGD.account_group.group_type,Scheme: GSGD_ACCOUNT_GROUP_TYPE.,GSGD_ACCOUNT_GROUP_TYPE,
