attribute_name,description,data_domain,nullable,is_primary_key,status,source_columns,comment,classification_context,etl_derived_value
Geographic Area Id,Khóa đại diện cho khu vực địa lý.,Surrogate Key,false,true,draft,,PK surrogate. Shared entity — dùng chung với FIMS.NATIONAL và SCMS.DM_TINH_THANH.,,
Geographic Area Code,Mã định danh (tự động tăng). BK.,Text,false,false,draft,SCMS.DM_QUOC_TICH.ID,BK chính. PK nguồn.,,
Source System Code,Mã nguồn dữ liệu.,Classification Value,false,false,draft,,Scheme: SOURCE_SYSTEM. BK. Hardcode.,SOURCE_SYSTEM=SCMS.DM_QUOC_TICH,
Geographic Area Type Code,Loại khu vực địa lý: COUNTRY — quốc gia/quốc tịch.,Classification Value,false,false,draft,,Scheme: GEOGRAPHIC_AREA_TYPE. ETL-derived: hardcode COUNTRY cho bảng này.,GEOGRAPHIC_AREA_TYPE=COUNTRY,COUNTRY
Geographic Area Business Code,Mã quốc tịch/quốc gia (mã nghiệp vụ).,Text,true,false,draft,SCMS.DM_QUOC_TICH.MA_QUOC_TICH,,,
Geographic Area Name,Tên quốc tịch/quốc gia.,Text,false,false,draft,SCMS.DM_QUOC_TICH.TEN_QUOC_TICH,,,
Note,Ghi chú.,Text,true,false,draft,SCMS.DM_QUOC_TICH.GHI_CHU,,,
Life Cycle Status Code,Trạng thái sử dụng.,Classification Value,true,false,draft,SCMS.DM_QUOC_TICH.TRANG_THAI,Scheme: LIFE_CYCLE_STATUS.,,
Created Timestamp,Ngày tạo.,Timestamp,true,false,draft,SCMS.DM_QUOC_TICH.NGAY_TAO,,,
