attribute_name,description,data_domain,nullable,is_primary_key,status,source_columns,comment,classification_context,etl_derived_value
Involved Party Id,FK đến Inspection Subject Other Party.,Surrogate Key,false,false,draft,ThanhTra.DM_DOI_TUONG_KHAC.ID,"FK target: Inspection Subject Other Party.Inspection Subject Other Party Id.",,
Involved Party Code,Mã đối tượng thanh tra.,Text,false,false,draft,ThanhTra.DM_DOI_TUONG_KHAC.ID,"FK target: Inspection Subject Other Party.Inspection Subject Other Party Code. Pair with Involved Party Id.",,
Source System Code,Mã hệ thống nguồn.,Classification Value,false,false,draft,,,SOURCE_SYSTEM=ThanhTra.DM_DOI_TUONG_KHAC,
Electronic Address Type Code,Loại kênh liên lạc — số điện thoại.,Classification Value,false,false,draft,,,IP_ELEC_ADDR_TYPE=PHONE,
Electronic Address Value,Số điện thoại.,Text,true,false,draft,ThanhTra.DM_DOI_TUONG_KHAC.SO_DIEN_THOAI,,IP_ELEC_ADDR_TYPE=PHONE,
Electronic Address Type Code,Loại kênh liên lạc — fax.,Classification Value,false,false,draft,,,IP_ELEC_ADDR_TYPE=FAX,
Electronic Address Value,Số fax.,Text,true,false,draft,ThanhTra.DM_DOI_TUONG_KHAC.FAX,,IP_ELEC_ADDR_TYPE=FAX,
Electronic Address Type Code,Loại kênh liên lạc — email.,Classification Value,false,false,draft,,,IP_ELEC_ADDR_TYPE=EMAIL,
Electronic Address Value,Email.,Text,true,false,draft,ThanhTra.DM_DOI_TUONG_KHAC.EMAIL,,IP_ELEC_ADDR_TYPE=EMAIL,
