datamart_entity,table_type,status,description,source_table,FKs
Calendar Date Dimension,dim,draft,Lịch ngày — năm/quý/tháng phục vụ slicer và phân tích theo thời gian,Generated,
Classification Dimension,dim,draft,Danh mục phân loại — phục vụ 3 scheme trên 2 Fact: TT_SUBJECT_CATEGORY (6 giá trị tạm thời) / TT_PENALTY_SUBJECT_CATEGORY (4 giá trị) / TT_VIOLATION_TYPE (11 giá trị). Mọi query JOIN phải kèm WHERE Scheme='...',Generated,
Fact Inspection Case Activity,fact,draft,Event vụ việc TT/KT — 1 row per hồ sơ × đối tượng. Đếm hồ sơ dùng COUNT(DISTINCT Inspection_Case_Code). Date key: Received Date (xem O_TT_3),Inspection Case / Inspection Decision Subject / Inspection Case Conclusion,Calendar Date Dimension.Received Date Dimension Id | Classification Dimension.Subject Category Dimension Id | Classification Dimension.Violation Type Dimension Id
Fact Penalty Decision,fact,draft,Event quyết định xử phạt — 1 row per GS_VAN_BAN_XU_LY. Date key: Violation Report Date. Xem O_TT_8 (Violation Type) và O_TT_9 (Penalty Subject Category),Surveillance Enforcement Decision,Calendar Date Dimension.Violation Report Date Dimension Id | Classification Dimension.Penalty Subject Category Dimension Id | Classification Dimension.Violation Type Dimension Id
Inspection Case List,operational,draft,Hồ sơ TT/KT — latest state per hồ sơ (1 row per TT_HO_SO). Phục vụ tra cứu danh sách Nhóm 5 (TT) và Nhóm 10 (KT),Inspection Case / Inspection Decision,
Penalty Decision List,operational,draft,Quyết định xử phạt — latest state per QĐ (1 row per GS_VAN_BAN_XU_LY). Phục vụ tra cứu danh sách Nhóm 15 (XP),Surveillance Enforcement Decision / Surveillance Enforcement Case,
Complaint Petition List,operational,draft,Đơn thư khiếu nại tố cáo — latest state per đơn (1 row per DT_DON_THU). Phục vụ cả KPI aggregate (Nhóm 16-18) và danh sách chi tiết (Nhóm 19),Complaint Petition,
