attribute_name,description,data_domain,nullable,is_primary_key,status,source_columns,comment
Custodian Bank Id,Khóa đại diện cho ngân hàng lưu ký giám sát.,Surrogate Key,false,true,draft,,
Custodian Bank Code,Mã ngân hàng LKGS do hệ thống FMS sinh ra. Map từ PK bảng nguồn.,Text,false,false,draft,FMS.BANKMONI.Id,BCV Term: Custodian. BK của entity.
Source System Code,Mã hệ thống nguồn.,Classification Value,false,false,draft,,Scheme: SOURCE_SYSTEM. Giá trị: FMS.BANKMONI.
Organization Name,Tên đầy đủ ngân hàng LKGS.,Text,true,false,draft,FMS.BANKMONI.Name,
Abbreviation,Tên viết tắt ngân hàng LKGS.,Text,true,false,draft,FMS.BANKMONI.ShortName,
Activity Status Code,Mã ID trạng thái hoạt động. FK → STATUS.Id.,Classification Value,true,false,draft,FMS.BANKMONI.Status,Scheme: FMS_OPERATION_STATUS. Values load từ bảng STATUS nguồn.
Is Data Migration,1 = Dữ liệu đổ từ hệ thống cũ; 0 = Dữ liệu mới.,Indicator,true,false,draft,FMS.BANKMONI.IsDataMigration,Trường kỹ thuật migration.
