attribute_name,description,data_domain,nullable,is_primary_key,status,source_columns,comment
FMS Fund Distribution Agent Organization Unit Id,Khóa đại diện cho CN/PGD của đại lý phân phối quỹ.,Surrogate Key,false,true,draft,,
FMS Fund Distribution Agent Organization Unit Code,Mã CN/PGD do hệ thống FMS sinh ra. Map từ PK bảng nguồn.,Text,false,false,draft,FMS.AGENCIESBRA.Id,BCV Term: Organization Unit. BK của entity.
Source System Code,Mã hệ thống nguồn.,Classification Value,false,false,draft,,Scheme: SOURCE_SYSTEM. Giá trị: FMS.AGENCIESBRA.
Fund Distribution Agent Id,Khóa đại diện đại lý phân phối chủ quản. FK → AGENCIES.,Surrogate Key,false,false,draft,FMS.AGENCIESBRA.AgnId,FK target: Fund Distribution Agent.Fund Distribution Agent Id. Pair with Fund Distribution Agent Code.
Fund Distribution Agent Code,Mã đại lý phân phối chủ quản. Lưu dư thừa.,Text,false,false,draft,FMS.AGENCIESBRA.AgnId,FK target: Fund Distribution Agent.Fund Distribution Agent Code. Pair with Fund Distribution Agent Id.
Organization Name,Tên CN/PGD của đại lý phân phối quỹ.,Text,true,false,draft,FMS.AGENCIESBRA.Name,
Activity Status Code,Mã ID trạng thái hoạt động. FK → STATUS.Id.,Classification Value,true,false,draft,FMS.AGENCIESBRA.Status,Scheme: FMS_OPERATION_STATUS. Values load từ bảng STATUS nguồn.
