attribute_name,description,data_domain,nullable,is_primary_key,status,source_columns,comment
Reporting Period Id,Khóa đại diện cho kỳ báo cáo.,Surrogate Key,No,Yes,draft,,
Reporting Period Code,Mã kỳ báo cáo do hệ thống FMS sinh ra. Map từ PK bảng nguồn.,Text,No,No,draft,RPTPERIOD.Id,BCV: không có term chính xác. BK của entity.
Source System Code,Mã hệ thống nguồn.,Classification Value,No,No,draft,,"Scheme: SOURCE_SYSTEM. Giá trị: FMS.RPTPERIOD"
Reporting Period Name,Tên kỳ báo cáo.,Text,Yes,No,draft,RPTPERIOD.PeriodName,
Reporting Period Type Code,Loại kỳ báo cáo: 1 = Ngày; 2 = Tuần; 3 = Tháng; 4 = Quý; 5 = Bán niên; 6 = Năm.,Classification Value,Yes,No,draft,RPTPERIOD.PeriodType,"Scheme: FMS_REPORTING_PERIOD_TYPE. ETL-derived: DAILY/WEEKLY/MONTHLY/QUARTERLY/SEMI_ANNUAL/ANNUAL."
Is Active Indicator,Trạng thái sử dụng: 1 = Sử dụng; 0 = Không sử dụng.,Indicator,Yes,No,draft,RPTPERIOD.IsActive,
