attribute_name,description,data_domain,nullable,is_primary_key,status,source_columns,comment,classification_context,etl_derived_value
Involved Party Id,FK đến Securities Organization Reference,Surrogate Key,false,false,draft,NHNCK.Organizations.Id,FK target: Securities Organization Reference.Securities Organization Reference Id. Shared entity — không có PK surrogate riêng.,,
Involved Party Code,Mã tổ chức,Text,false,false,draft,NHNCK.Organizations.Id,FK target: Securities Organization Reference.Securities Organization Reference Code. Pair with Involved Party Id.,,
Source System Code,Mã nguồn dữ liệu,Classification Value,false,false,draft,,,SOURCE_SYSTEM=NHNCK.Organizations
Address Type Code,Loại địa chỉ — trụ sở chính,Classification Value,false,false,draft,,,IP_ADDR_TYPE=HEAD_OFFICE
Address Line,Địa chỉ tổ chức,Text,true,false,draft,NHNCK.Organizations.Address,,IP_ADDR_TYPE=HEAD_OFFICE,
