attribute_name,description,data_domain,nullable,is_primary_key,status,source_columns,comment,classification_context,etl_derived_value
Involved Party Id,FK đến Foreign Investor.,Surrogate Key,false,false,draft,FIMS.INVESTOR.id,FK target: Foreign Investor.Foreign Investor Id. Shared entity — không có PK surrogate riêng.,,
Involved Party Code,Mã nhà đầu tư nước ngoài.,Text,false,false,draft,FIMS.INVESTOR.id,FK target: Foreign Investor.Foreign Investor Code. Pair with Involved Party Id.,,
Source System Code,Mã nguồn dữ liệu.,Classification Value,false,false,draft,,,SOURCE_SYSTEM=FIMS.INVESTOR,
Address Type Code,Loại địa chỉ — địa chỉ chung.,Classification Value,false,false,draft,,,IP_ADDR_TYPE=ADDRESS,ADDRESS
Address Value,Địa chỉ nhà đầu tư.,Text,true,false,draft,FIMS.INVESTOR.Address,,IP_ADDR_TYPE=ADDRESS,
