attribute_name,description,data_domain,nullable,is_primary_key,status,source_columns,comment,classification_context,etl_derived_value
Disclosure Representative Key Person Id,Khóa đại diện cho nhân sự thực hiện CBTT.,Surrogate Key,false,true,draft,,PK surrogate.,,
Disclosure Representative Key Person Code,Mã định danh nhân sự CBTT. Map từ PK bảng nguồn.,Text,false,false,draft,FIMS.TLPROFILES.Id,BK chính.,,
Source System Code,Mã nguồn dữ liệu.,Classification Value,false,false,draft,,Scheme: SOURCE_SYSTEM. BK. Hardcode.,SOURCE_SYSTEM=FIMS.TLPROFILES,
Geographic Area Id,FK đến quốc tịch của nhân sự.,Surrogate Key,true,false,draft,FIMS.TLPROFILES.NaId,FK target: Geographic Area.Geographic Area Id. ID quốc tịch lấy từ bảng NATIONAL.,,
Geographic Area Code,Mã quốc tịch.,Text,true,false,draft,FIMS.TLPROFILES.NaId,FK target: Geographic Area.Geographic Area Code. Pair with Geographic Area Id.,,
Fund Management Company Id,FK đến công ty QLQ (nullable — nhân sự có thể gắn với nhiều tổ chức).,Surrogate Key,true,false,draft,FIMS.TLPROFILES.FundComId,FK target: Fund Management Company.Fund Management Company Id. ID lấy từ bảng FUNDCOMPANY.,,
Fund Management Company Code,Mã công ty QLQ.,Text,true,false,draft,FIMS.TLPROFILES.FundComId,FK target: Fund Management Company.Fund Management Company Code. Pair with Fund Management Company Id.,,
Securities Company Id,FK đến công ty chứng khoán (nullable).,Surrogate Key,true,false,draft,FIMS.TLPROFILES.SecComId,FK target: Securities Company.Securities Company Id. ID lấy từ bảng SECURITIESCOMPANY.,,
Securities Company Code,Mã công ty chứng khoán.,Text,true,false,draft,FIMS.TLPROFILES.SecComId,FK target: Securities Company.Securities Company Code. Pair with Securities Company Id.,,
Custodian Bank Id,FK đến ngân hàng lưu ký giám sát (nullable).,Surrogate Key,true,false,draft,FIMS.TLPROFILES.BankId,FK target: Custodian Bank.Custodian Bank Id. ID lấy từ bảng BANKMONI.,,
Custodian Bank Code,Mã ngân hàng lưu ký giám sát.,Text,true,false,draft,FIMS.TLPROFILES.BankId,FK target: Custodian Bank.Custodian Bank Code. Pair with Custodian Bank Id.,,
Depository Center Id,FK đến trung tâm lưu ký (nullable).,Surrogate Key,true,false,draft,FIMS.TLPROFILES.DepCenId,FK target: Depository Center.Depository Center Id. ID lấy từ bảng DEPOSITORYCENTER.,,
Depository Center Code,Mã trung tâm lưu ký.,Text,true,false,draft,FIMS.TLPROFILES.DepCenId,FK target: Depository Center.Depository Center Code. Pair with Depository Center Id.,,
Stock Exchange Id,FK đến sở giao dịch chứng khoán (nullable).,Surrogate Key,true,false,draft,FIMS.TLPROFILES.StockCenId,FK target: Stock Exchange.Stock Exchange Id. ID lấy từ bảng STOCKEXCHANGE.,,
Stock Exchange Code,Mã sở giao dịch chứng khoán.,Text,true,false,draft,FIMS.TLPROFILES.StockCenId,FK target: Stock Exchange.Stock Exchange Code. Pair with Stock Exchange Id.,,
Disclosure Representative Id,FK đến người đại diện CBTT (nullable).,Surrogate Key,true,false,draft,FIMS.TLPROFILES.InDiRepCenId,FK target: Disclosure Representative.Disclosure Representative Id. ID lấy từ bảng INFODISCREPRES.,,
Disclosure Representative Code,Mã người đại diện CBTT.,Text,true,false,draft,FIMS.TLPROFILES.InDiRepCenId,FK target: Disclosure Representative.Disclosure Representative Code. Pair with Disclosure Representative Id.,,
Degree Code,ID trình độ. Dữ liệu lấy từ trường ID của bảng DEGREE.,Classification Value,true,false,draft,FIMS.TLPROFILES.DegreeId,Scheme: FIMS_DEGREE.,,
Life Cycle Status Code,Trạng thái nhân sự: 1: Còn hiệu lực 2: Hết hiệu lực 3: Vô thời hạn.,Classification Value,true,false,draft,FIMS.TLPROFILES.StatusId,Scheme: LIFE_CYCLE_STATUS.,,
Member Object Type Code,"Loại đối tượng: 1: Công ty QLQ 2: CTCK 3: NHLK 4: TTLK 5: SGDCK 6: Người đại diện CBTT 7: CN công ty QLQ NN tại VN.",Classification Value,true,false,draft,FIMS.TLPROFILES.SystemObject,Scheme: FIMS_MEMBER_TYPE. modeler_defined — 7 giá trị enum.,,
Full Name,Họ và tên nhân sự CBTT.,Text,false,false,draft,FIMS.TLPROFILES.Name,,,
Date Of Birth,Ngày sinh.,Date,true,false,draft,FIMS.TLPROFILES.DateOfBirth,,,
Place Of Birth,Nơi sinh.,Text,true,false,draft,FIMS.TLPROFILES.PlaceOfBirth,,,
Gender Code,Giới tính: 1: Nam 2: Nữ.,Classification Value,true,false,draft,FIMS.TLPROFILES.Sex,Scheme: IP_GENDER.,,
Is Legal Representative Indicator,Là người đại diện pháp luật: 1: Có 0: Không.,Indicator,true,false,draft,FIMS.TLPROFILES.IsRepresentative,,,
Legal Representative Email,Email người đại diện pháp luật.,Text,true,false,draft,FIMS.TLPROFILES.EmailRepresentative,Denormalized — áp dụng khi IsRepresentative = 1.,,
Work Start Date,Ngày bắt đầu làm việc.,Date,true,false,draft,FIMS.TLPROFILES.SWorkDTE,,,
Work End Date,Ngày kết thúc làm việc.,Date,true,false,draft,FIMS.TLPROFILES.FWorkDTE,,,
Job Type Codes,"Danh sách mã chức vụ. Từ bảng junction TLPROJOB.",Array<Text>,true,false,draft,FIMS.TLPROJOB.JobTypeId,"Pure junction TLPROJOB → denormalize thành ARRAY. Scheme: FIMS_JOB_TYPE. HLD decision: FIMS_HLD_Tier1.md.",,
Stockholder Type Codes,"Danh sách mã loại cổ đông. Từ bảng junction TLPROSTOCKH.",Array<Text>,true,false,draft,FIMS.TLPROSTOCKH.StockHolderId,"Pure junction TLPROSTOCKH → denormalize thành ARRAY. Scheme: FIMS_STOCKHOLDER_TYPE. HLD decision: FIMS_HLD_Tier1.md.",,
Description,Mô tả.,Text,true,false,draft,FIMS.TLPROFILES.Description,,,
Created By,Người tạo bản ghi.,Text,true,false,draft,FIMS.TLPROFILES.CreatedBy,Mã người dùng hệ thống — denormalized.,,
Created Timestamp,Ngày tạo bản ghi.,Timestamp,true,false,draft,FIMS.TLPROFILES.DateCreated,,,
Updated Timestamp,Ngày cập nhật bản ghi.,Timestamp,true,false,draft,FIMS.TLPROFILES.DateModified,,,
