attribute_name,description,data_domain,nullable,is_primary_key,status,source_columns,comment,classification_context,etl_derived_value
Involved Party Id,FK đến Fund Management Company Organization Unit.,Surrogate Key,false,false,draft,FIMS.BRANCHS.id,FK target: Fund Management Company Organization Unit.Fund Management Company Organization Unit Id. Shared entity — không có PK surrogate riêng.,,
Involved Party Code,Mã chi nhánh công ty quản lý quỹ.,Text,false,false,draft,FIMS.BRANCHS.id,Lookup pair: Fund Management Company Organization Unit.Fund Management Company Organization Unit Code. Pair with Involved Party Id.,,
Source System Code,Mã nguồn dữ liệu.,Classification Value,false,false,draft,,,SOURCE_SYSTEM=FIMS.BRANCHS,
Address Type Code,Loại địa chỉ — trụ sở chính.,Classification Value,false,false,draft,,,IP_ADDR_TYPE=HEAD_OFFICE,HEAD_OFFICE
Address Value,Địa chỉ trụ sở.,Text,true,false,draft,FIMS.BRANCHS.Address,,IP_ADDR_TYPE=HEAD_OFFICE,
